{
  "$schema": "https://json-schema.org/draft/2020-12/schema",
  "title": "FlowDefinition",
  "description": "Admin-authored configuration for a flow. A flow definition is a directed graph of steps backed by a user schema. The flow engine selects a definition based on `purpose` and `audience`, then walks the graph by evaluating `transitions` against client submissions.  This schema describes the configuration shape only. Runtime emission to the client (capability dictionaries, branding, localized text) is a separate concern and is not modelled here.",
  "type": "object",
  "required": [
    "name",
    "status",
    "user_schema",
    "purposes",
    "steps"
  ],
  "additionalProperties": false,
  "properties": {
    "$schema": {
      "type": "string",
      "description": "Editor affordance: path or URL of this meta-schema so editors validate and autocomplete the file (scaffolded flow files point at `.zitadel/meta/flow-definition.json`). Ignored by the platform."
    },
    "name": {
      "type": "string",
      "pattern": "^[a-z][a-z0-9-]*$",
      "examples": [
        "standard-login",
        "combined-auth"
      ],
      "description": "Stable identifier for this flow, used as the target of cross-flow `switch` and `pivot` transitions. Renaming is not supported — the `name` is part of the public contract another definition may reference. Acts as the human display label as well; no separate slug."
    },
    "status": {
      "type": "string",
      "enum": [
        "active",
        "draft"
      ],
      "description": "Lifecycle state. - active: the engine can select this definition for new flows. - draft: never selected for new flows; existing flows referencing it must handle it gracefully."
    },
    "user_schema": {
      "type": "string",
      "examples": [
        "sch_01KWHF18816ZQESRCS7Z2STJ05"
      ],
      "description": "Server-assigned identifier of the user schema this flow operates on, as returned by `POST /schemas`. Opaque to the client — the shape is a server implementation detail. Step `fields` reference property names defined in that schema; the engine resolves field type, validation, and implicit transition outcomes from the schema's `x-*` annotations at runtime."
    },
    "purposes": {
      "type": "object",
      "minProperties": 1,
      "propertyNames": {
        "$ref": "#/$defs/Purpose"
      },
      "additionalProperties": {
        "type": "string",
        "description": "Name of an entry-point step within this definition."
      },
      "examples": [
        {
          "login": "identify"
        },
        {
          "login": "identify",
          "register": "identify"
        }
      ],
      "description": "Maps each purpose this definition handles to the step that begins the flow for that purpose. Every value must match a `name` in `steps`; the check is enforced by the engine, not by this schema."
    },
    "audience": {
      "$ref": "#/$defs/Audience",
      "description": "Scopes which requests this definition applies to. Omitted or empty arrays mean project-wide. The engine ranks matches by specificity (app > team > project-wide)."
    },
    "steps": {
      "type": "array",
      "minItems": 1,
      "items": {
        "$ref": "#/$defs/Step"
      },
      "description": "Step graph. Order is for human readability; actual sequencing is determined entirely by `transitions`. Every step's `name` must be unique within this array."
    }
  },
  "$defs": {
    "Purpose": {
      "type": "string",
      "enum": [
        "login",
        "register",
        "recovery",
        "profiling",
        "reauth",
        "link_account"
      ],
      "description": "What the user is trying to accomplish. - login: authenticate an existing user. - register: create a new user. - recovery: recover access (e.g. password reset). - profiling: collect required profile fields after authentication. - reauth: re-verify factors on an active session for step-up. - link_account: attach an external identity to an existing user."
    },
    "Audience": {
      "type": "object",
      "additionalProperties": false,
      "properties": {
        "team_ids": {
          "type": "array",
          "uniqueItems": true,
          "items": {
            "type": "string"
          },
          "examples": [
            [
              "team_acme"
            ]
          ],
          "description": "Restrict to specific teams (organizations)."
        },
        "app_ids": {
          "type": "array",
          "uniqueItems": true,
          "items": {
            "type": "string"
          },
          "examples": [
            [
              "app_dashboard"
            ]
          ],
          "description": "Restrict to specific applications."
        }
      }
    },
    "Step": {
      "type": "object",
      "required": [
        "name"
      ],
      "additionalProperties": false,
      "properties": {
        "name": {
          "type": "string",
          "pattern": "^[a-z][a-z0-9-]*$",
          "examples": [
            "identify",
            "authenticate",
            "done"
          ],
          "description": "Unique step identifier within this definition. Slug-shaped so it is safe to use as a transition `target` and as a value in `purposes`. Referenced by other steps in the same definition."
        },
        "fields": {
          "type": "array",
          "uniqueItems": true,
          "items": {
            "type": "string"
          },
          "examples": [
            [
              "email"
            ],
            [
              "email",
              "password"
            ]
          ],
          "description": "Schema property names to collect from the user on this step. Each entry must resolve to a property in the definition's `user_schema`, or use the reserved token `x-auth-methods#<method>` (e.g. `x-auth-methods#password`) to collect a credential proof for a method enabled at the schema root. The engine reads the schema's `x-*` annotations to derive: - field type and validation (rendered into the runtime payload), - implicit transition outcomes - e.g. a property with a non-empty `x-unique` scope makes `user_not_found` a valid `transitions` key on this step."
        },
        "actions": {
          "type": "array",
          "items": {
            "$ref": "#/$defs/Action"
          },
          "description": "Ordered list of actions the user can take on this step. The `name` is what the client echoes back on submit. Every action's name must have a matching key in `transitions`; the engine rejects submissions for actions without a defined transition."
        },
        "gates": {
          "type": "object",
          "additionalProperties": {
            "$ref": "#/$defs/Gate"
          },
          "description": "Security challenges that must be satisfied before this step's submission is accepted. Keyed by gate name (free identifier; referenced as the key in the runtime `step.gates` dictionary). The engine may inject additional gates at runtime based on policy or risk evaluation."
        },
        "sso_providers": {
          "type": "array",
          "uniqueItems": true,
          "items": {
            "type": "string",
            "pattern": "^[a-z0-9][a-z0-9_-]*$",
            "maxLength": 64
          },
          "examples": [
            [
              "google",
              "github"
            ]
          ],
          "description": "Slugs of the identity provider connections offered on this step. Each entry must match the `slug` of a connection in the project; the connection supplies the display name and template at render time. When non-empty, the step must define a `transitions.callback` entry — the engine handles the reserved `sso` action transparently (redirect to the IdP, code exchange, user resolution) and fires `callback` on this step when the IdP returns. The flow author never writes a `transitions.sso`."
        },
        "on_success": {
          "type": "string",
          "enum": [
            "create_user",
            "create_user_with_sso"
          ],
          "description": "Server-side mutation to run after the step's fields validate and before the transition fires. - create_user: materialize the user from collected schema   fields. Used by register flows. - create_user_with_sso: materialize the user from the resolved external identity plus the collected fields. Used by the collection step an `identity_unknown` outcome routes to."
        },
        "complete": {
          "type": "string",
          "enum": [
            "redirect",
            "show"
          ],
          "description": "Marks this step as terminal. A terminal step has no `fields`, `actions`, `transitions`, `gates`, or `sso_providers`. - redirect: client navigates to a `redirect_uri` resolved from   the originating protocol request (OIDC, SAML). - show: client renders the step as a success or info screen."
        },
        "transitions": {
          "type": "object",
          "additionalProperties": {
            "$ref": "#/$defs/Transition"
          },
          "description": "Maps action names and engine-emitted outcomes to the next state. Keys are either: - an action name declared in this step's `actions`, or - a reserved outcome the engine produces: - `user_not_found` - emitted when a unique field (`x-unique`) does not match an existing user. - `user_already_exists` - emitted when registration matches an existing user. - `identity_unknown` - emitted when SSO resolution finds no user for the provider's subject; flips a login flow to register. - `callback` - emitted when an external system returns control to the flow (SSO callback, device authorization poll, etc.). A transition's `action` field controls whether the target is interpreted as a step in this definition (default) or as the name of another definition to switch or pivot into."
        }
      }
    },
    "Action": {
      "type": "object",
      "additionalProperties": false,
      "properties": {
        "name": {
          "type": "string",
          "minLength": 1,
          "examples": [
            "submit",
            "passkey",
            "email_fallback"
          ],
          "description": "Action identifier, echoed back by the client on submit and matched against `transitions`. The name `back` is reserved for engine-injected back navigation."
        },
        "kind": {
          "type": "string",
          "enum": [
            "submit",
            "passkey",
            "passkey_register",
            "navigate"
          ],
          "description": "How the engine handles the action. - submit: collect the step's fields and run validate/dispatch/on_success. - passkey: issue a WebAuthn assertion challenge; the matching transition fires once the assertion verifies. - passkey_register: issue a WebAuthn registration challenge; the matching transition fires once the attestation verifies. - navigate: route through the transition without running the input pipeline. (`back` exists on the wire but is engine-injected; declaring it is rejected.)"
        },
        "primary": {
          "type": "boolean",
          "default": false,
          "description": "Marks this as the default/primary action. The runtime template uses this hint to choose visual emphasis. At most one action per step should be primary; this is not enforced here."
        },
        "text_key": {
          "type": "string",
          "examples": [
            "actions.signin.submit"
          ],
          "description": "Optional localization key override for the action's label. When omitted, the engine derives a key from the step and action names. Display text is resolved client-side from a locale dictionary, never by the engine."
        }
      },
      "description": "Configuration for a user-invokable action on a step.",
      "required": [
        "name",
        "kind"
      ]
    },
    "Gate": {
      "type": "object",
      "required": [
        "kind",
        "provider"
      ],
      "additionalProperties": false,
      "properties": {
        "kind": {
          "type": "string",
          "enum": [
            "captcha"
          ],
          "description": "The gate category. Only `captcha` is currently defined. Authenticator ceremonies (e.g. passkey) are modelled as credential auth_attempts via `x-credential` on a field, not as gates."
        },
        "provider": {
          "type": "string",
          "examples": [
            "altcha",
            "turnstile",
            "hcaptcha"
          ],
          "description": "Provider identifier within the gate kind — e.g. `altcha`, `turnstile`, `hcaptcha`. The engine looks up an implementation in its provider registry."
        },
        "config": {
          "type": "object",
          "additionalProperties": true,
          "examples": [
            {
              "site_key": "0x4AAAAAAAxxxxxxxxxxxxxx"
            }
          ],
          "description": "Provider-specific configuration consumed by the implementation when issuing the per-render challenge. Opaque to the engine."
        }
      }
    },
    "Transition": {
      "type": "object",
      "required": [
        "target"
      ],
      "additionalProperties": false,
      "properties": {
        "target": {
          "type": "string",
          "examples": [
            "authenticate",
            "register",
            "recovery"
          ],
          "description": "When `action` is omitted, the `name` of a step in the same definition. When `action` is `switch` or `pivot`, the `name` of another flow definition in the same project."
        },
        "action": {
          "type": [
            "string",
            "null"
          ],
          "enum": [
            "switch",
            "pivot",
            null
          ],
          "description": "How to interpret `target`. - Omitted: transition to a step in the current definition. - `switch`: replace the current flow with the target flow.   No return; the current flow is discarded. Typical use:   navigating between peer flows like login ↔ register. - `pivot`: push the target flow onto the stack. The current   flow is paused; when the target flow completes the engine   auto-pops back. Typical use: login → recovery → back to login."
        },
        "purpose": {
          "type": [
            "string",
            "null"
          ],
          "enum": [
            "login",
            "register",
            "recovery",
            "profiling",
            "reauth",
            "link_account",
            null
          ],
          "description": "Local re-purposing. When set, taking this transition changes the flow's current purpose to this value — the dispatch mode a step's challenges run under — while the flow's original purpose stays pinned. Must be a purpose this definition serves, and `target` must be that purpose's entry step. Mutually exclusive with `action`: a transition either re-purposes within this flow or targets another flow, never both. Example: a \"Sign up\" navigation on the login identifier step (`{ \"target\": \"register\", \"purpose\": \"register\" }`)."
        }
      }
    }
  }
}
