{
  "$schema": "../meta/flow-definition.json",
  "name": "default-login",
  "status": "active",
  "user_schema": "human-user",
  "purposes": {
    "login": "identifier",
    "register": "register"
  },
  "steps": [
    {
      "name": "identifier",
      "fields": [
        "email"
      ],
      "actions": [
        {
          "name": "submit",
          "kind": "submit",
          "primary": true,
          "text_key": "identifier.action.continue"
        },
        {
          "name": "register",
          "kind": "navigate",
          "primary": false,
          "text_key": "identifier.action.register.link"
        }
      ],
      "transitions": {
        "submit": {
          "target": "password"
        },
        "user_not_found": {
          "target": "register"
        },
        "register": {
          "target": "register",
          "purpose": "register"
        }
      }
    },
    {
      "name": "password",
      "fields": [
        "x-auth-methods#password"
      ],
      "actions": [
        {
          "name": "submit",
          "kind": "submit",
          "primary": true,
          "text_key": "password.action.signin"
        }
      ],
      "transitions": {
        "submit": {
          "target": "done"
        }
      }
    },
    {
      "name": "register",
      "fields": [
        "email"
      ],
      "actions": [
        {
          "name": "submit",
          "kind": "submit",
          "primary": true,
          "text_key": "register.action.password"
        },
        {
          "name": "sign_in",
          "kind": "navigate",
          "primary": false,
          "text_key": "register.action.sign_in.link"
        }
      ],
      "transitions": {
        "submit": {
          "target": "register-password"
        },
        "user_already_exists": {
          "target": "password"
        },
        "sign_in": {
          "target": "identifier",
          "purpose": "login"
        }
      }
    },
    {
      "name": "register-password",
      "fields": [
        "x-auth-methods#password"
      ],
      "actions": [
        {
          "name": "submit",
          "kind": "submit",
          "primary": true,
          "text_key": "register-password.action.submit"
        }
      ],
      "on_success": "create_user",
      "transitions": {
        "submit": {
          "target": "done"
        },
        "user_already_exists": {
          "target": "password"
        }
      }
    },
    {
      "name": "done",
      "complete": "show"
    }
  ]
}
